{
  "schema_version": 1,
  "adapter_contract_version": 1,
  "status": "PASS",
  "candidate": {
    "id": "synthetic_high_performance",
    "label": "Synthetic high-performance candidate",
    "parameters": {
      "lanes": null,
      "bank_port_mode": null,
      "scheduler_policy": null,
      "context_depth": null
    }
  },
  "claim_class": "assumed",
  "operating_point": {
    "pdk": null,
    "library": null,
    "process_corner": null,
    "voltage_V": null,
    "temperature_C": 26.85,
    "clock_constraint_ns": 10.0,
    "workload_trace_id": "fixture:synthetic_high_performance"
  },
  "source_evidence": [
    {
      "path": "hardware_cost/regression/synthetic_candidate_definitions.json",
      "sha256": "25788f3a97948467c0b0cacc4786f60b2a9fc2dd0ee590c317e3aa1c1821b820",
      "bytes": 2365
    }
  ],
  "notes": [
    "Deterministic synthetic fixture; not physical evidence."
  ],
  "axis": "area",
  "calibration": "synthetic",
  "tool": {
    "name": "synthetic-area-fixture",
    "version": "1"
  },
  "metrics": {
    "precision": "BF16",
    "primary_category": "normalization_rounding",
    "generic_cells": 150000,
    "generic_topological_path_length": 520,
    "technology_mapped_area_um2": null,
    "mapped_floorplan_area_um2": 14000000.0,
    "categories": {
      "bf16_fp16": {
        "mapped_area_um2": 4480000.0,
        "dynamic_power_W": null,
        "leakage_power_W": null,
        "total_power_W": null
      },
      "normalization_rounding": {
        "mapped_area_um2": 3360000.0,
        "dynamic_power_W": null,
        "leakage_power_W": null,
        "total_power_W": null
      },
      "accumulator_reduction": {
        "mapped_area_um2": 2520000.0,
        "dynamic_power_W": null,
        "leakage_power_W": null,
        "total_power_W": null
      },
      "buffer_register": {
        "mapped_area_um2": 2240000.0,
        "dynamic_power_W": null,
        "leakage_power_W": null,
        "total_power_W": null
      },
      "control_routing": {
        "mapped_area_um2": 1400000.0,
        "dynamic_power_W": null,
        "leakage_power_W": null,
        "total_power_W": null
      }
    }
  }
}